facebook_corpus_msr_396174,If government of india don't take strict action against China then soon india will be on the loosing side sure,NAG
facebook_corpus_msr_422473,So now we know. The women should be under the veil. Because a dumb country is made to think that it's cool.,NAG
facebook_corpus_msr_341422,गद्दारो तुमसे ही तो खतरा है अबकी बार साफ हो जाओगे,NAG
facebook_corpus_msr_481654,Do you think markets are gonna be sideways till the results are out?,NAG
facebook_corpus_msr_427757,"Jago Urjut Jago....
Save common people from
reducing further Repo Rates .",NAG
facebook_corpus_msr_469689,"The point of demonetization is to stop use of cash the way india doing, india have to force all the big transactions through either check or creditcard, cash should only be used for small transactions",NAG
facebook_corpus_msr_470520,Hi anuj and Sonia pls share ur view on aviation sector.,NAG
facebook_corpus_msr_477554,As the govt banned Rs500& Rs1000 notes is govt is prepared to fulfill the requirement of new Rs500 & Rs2000 notes with in 50 days...???,NAG
facebook_corpus_msr_440935,Excise grew by 32% in November(festive season) as against 41% in October and 36% in September. The real effect of demonetisation is still to come...,NAG
facebook_corpus_msr_466432,Sab log doordarshi nhi hote ARADHANA ji...10% logo me Hi ye khoobi paayi jaati h...any ways... everybody has their own perception...it's Democratic country.... otherwise time will tell everything...,NAG
facebook_corpus_msr_408292,"India is a fake, Fragile and unatural union build by British to control the poor masses. it has become a monster for minorities and neighbors, almost 40% of Indian Land is direct under Indian Army control who commit grave human right abuses under notorious AFSPA , Kashmiris hate India for brutal illegal occupation of their land but shameless India so called upper Class Hindu elite doesnt want to Free Kashmir for their political gaines, India is the only country which is being run by Extremists apart from Israel.",NAG
facebook_corpus_msr_428078,This mineral rich state was completely exploited and ignored by all govts. With current dispensation hope to see this state rock with allround developments...,NAG
facebook_corpus_msr_456793,And sir please indicate the date when v will start normal withdrawals from bank to bring back confidence in economy,NAG
facebook_corpus_msr_407396,"PK Movie Bhagawan Shiv Ko Aapman Kiya..   I Hate BollyWood Pornmovies ...
I think BollyWood +Kiss+Bedscenes + Sex ==== Born #SunnyLeone .... Dekho Aur Siko Indian Culture Movies More in South. .... Encourage This Type of Movies #Rajamouli And #Prabhas",NAG
facebook_corpus_msr_496593,SIR YOU  CAN  MAKE IMPOSSIBLE MISSION TO POSSIBLE,NAG
facebook_corpus_msr_488495,What is ur view on the FMCG cos. Specifically HUL.,NAG
facebook_corpus_msr_495869,Team of Gujjus.... Ab India ki halat sudharegi. .. Kyuki Gujju Aur marwadi hi paise ki Kimat Jante hai....desh ka bhi bhala Aur khudka bhi....,NAG
facebook_corpus_msr_467320,Whatever it be.. The way manmohan Singh spoke with dignity and respect to the chair and pm..is the way a house should run.. Not particular party..  Or emergency word like current speaker is doing... House should run with respect,NAG
facebook_corpus_msr_382943,Itani garmi lag rahi thi to ye bhi nikal deti kya ho jata,NAG
facebook_corpus_msr_419939,We are proud of as such nessary step taken by newly elected CM within 2- 3 days,NAG
facebook_corpus_msr_490661,Whatss with u sonia ? Hope ur keeping well . You seem to lost weight ... ohh yeah i guess market running so up,NAG
facebook_corpus_msr_419656,Sad this brilliant man was rejected by people in elections. .... now those made fun get convinced  by him,NAG
facebook_corpus_msr_332395,Atul O Pathak you just compared a child's dress to lingerie.  Get a life dude!,NAG
facebook_corpus_msr_489120,Ha ha.. Nice try... Don't waste time you are getting late for terrorist recruitment rally..,NAG
facebook_corpus_msr_443565,"Plz share view on astech life??  Bought @675,  today made 52 week high?",NAG
facebook_corpus_msr_477597,"Those who comments against this decision, they are black money holders. IT to observe.",NAG
facebook_corpus_msr_443505,No point in doing this fb session without Anuj. It makes sense only with Anuj+Sonia. No other combination.,NAG
facebook_corpus_msr_330416,This bloody Islamic nations have nothing better to do than spreading tensions across the world...They just spoil peace in the name of religion...Having an Islamic country as neighbourhood is the biggest nightmare for a developing country,OAG
facebook_corpus_msr_352613,ABP news is a cheap grade News channel who has some low minded idiots reporters. Why they are high lighting Kajal's beaf party news since last 2 days.They want some bastered from Gay Rakshak gang attack on Kajol? She got it in hotel and ate eat. Does she made any crime or she killed a cow? Those who are non vegitarians may have tried bear in their life time.If any hotel is serving cow meat then only punish them and enquirer about the saurce from where they got such supply.So be vegitarian and remain happy.,NAG
facebook_corpus_msr_332446,How could a 12 year old be seductive to someone ??,NAG
facebook_corpus_msr_367185,They are like all Hindus .. only words not any action .,NAG
facebook_corpus_msr_330436,"Ashish jat you said kashmir dispute is a communal conflict good nice to heard you meant if Kashmiri are being killed Raped just because they belong ​to a particular community ( Muslim) and army troops are from different community ( hindu) ? 
and second thing is that our government itself doesn't want us Muslim to be part of Army or in other government officials we also don't Love to proceed toward gulf countries apart from motherland our families to earn breads if government given us opportunities to earn breads we would have never left motherland 😢😢😢😢",NAG
facebook_corpus_msr_470137,Do u really think India is thinking about Trump right now?,NAG
facebook_corpus_msr_483945,"Will give good returns as this is festive season and demand increasing accordingly in the market. 
Second, dollar is also weak as compared to rupee so :)",NAG
facebook_corpus_msr_456790,Feeling so good to see small vendors using Mobile  to accept payments. ..,NAG
facebook_corpus_msr_408959,sonia should be punished with slippers and shoes... Its totally nonsense and untolerable....,NAG
facebook_corpus_msr_408314,Pakistan is a terrorist country and no body would like to play with Pakistan,NAG
facebook_corpus_msr_440954,"Some years later a new PM will come and say.... We have been fooled and looted since 80 years, help me to build a better country..... LMFAO!",CAG
facebook_corpus_msr_481710,Will the jio fever protect reliance for long ? Other telecos will surely catch up soon enough ?,NAG
facebook_corpus_msr_335808,How come only Dakota take that water that to in only madya Pradesh,NAG
facebook_corpus_msr_496197,We  do  remember  RBI  Governor  Rajan's  Contribution  to  IIndian  Economy !  But  We  have  to  admit  there  are  similar  well  qualified  Economists  in  India !  When  Ala  Greenspan  retired  as  Federal  Reserve  Chairman  Peeople  thought  it  was  the  end  of  Dow  Jones  and  Wall  Street ! But  US  Economy  is  as  doing  as  well  as  it  can  considering  the  Falling  European  Union  and  also  the  UK  and  German  problems !  Why  not  make  SBI  CEO  Arubdhati  Bhattacharya  as the  RBI  Governor ? Give  her  a  Chance  and  She  will  do  a  Great  JOB  as  good  as  RAJAN !  You  do  not  have  to  be  US  qualified  for  this  JOB !!!,NAG
facebook_corpus_msr_326671,Build more water bodies in Maharashtra... Every village to have deep and wide water body,NAG
facebook_corpus_msr_471070,Some people are sending other people with their cash to stand in the Queue for exchange of notes and paying them some amount in return.,NAG
facebook_corpus_msr_403764,Yes agree that we need to have a fruitful talk on creating Kurdishthan as well,NAG
facebook_corpus_msr_325468,India should  summon the Pakistan Ambassador immediately and its obvious that Pakistan does not want Peace in the Region!!!!,NAG
facebook_corpus_msr_495868,"Welcome Mr.patel 
Rbi till now done great job and same expecting in future.",NAG
facebook_corpus_msr_358026,Next question!  Why does the word Abd'allah contain word allah before rise of islam???,NAG
facebook_corpus_msr_466407,And the literate has spoken..... such poise and well informed Man- our former PM. 👏👏👏. And kept dignity throughout. True Indian!,NAG
facebook_corpus_msr_333788,Saala darpok. When he comes to south he comes with full security. He makes early morning visit and runs away from backdoor :D,NAG
facebook_corpus_msr_487381,"launch date -iphone -june 2007 ...Phone 7 and 7 Plus..September 7, 2016-release date 
no pan card required ... required pan card for gold purchase above 2 lakh -what is the jewellery association doing ..are they are sleeping ...narayana narayana ...from naradha",NAG
facebook_corpus_msr_328475,"What the hell is going on? Glorification of mob justice and violence by Minister is unacceptable. If someone gifted bats to beat drunk woman ,media would have gone crazy and called it sexist and patriarchy....it seems many people accept violence and sexism against men. they are very hateful and sexist people..what is hope when people in power are glorifying violence? if same minister said men can beat woman who drink, he would probably have been booked under laws by now....
gender equality does not mean hatred and biased laws against men..remove all biased laws against men and if there are laws against woman, remove them as well.....",OAG
facebook_corpus_msr_333700,"My state of Assam would've never made it to the news for any other reason but wait, this story right here has got the perfect keyword to sell the NDTV's version of the ""perfect"" news-story, that keyword being ""C O W"".  Well, two men were ""lynched"" in my neighborhood just yesterday for trying to steal a motorcycle. How come that didn't make it to your headlines, eh NDTV? ;)",NAG
facebook_corpus_msr_385738,"nice together...
wish u a vry vry happy anniversory to u...",NAG
facebook_corpus_msr_467382,Thought he is dumb . But glad he speaks . But Donna.'s,NAG
facebook_corpus_msr_491708,this rate cut may help tim to have is hair cut .....,NAG
facebook_corpus_msr_491322,"If fed hikes rate, where will support on nifty be???",NAG
facebook_corpus_msr_429453,No one will buy better launch Nokia 1108 torch light phone at nominal rate with dual SIM !!,NAG
facebook_corpus_msr_402219,"ISMAIL KHAN ,FIRST  LEARN ENGLISH  U IDIOT  PAKISTANI  ,DON'T KNOW HOW TO  PUT A SENTENCE  ,BETA HAS NOT YET STARTED, ITS A PROXY WAR BY YOUR  TERROR  EXPORT ISI AND ARMY ,THE REAL BATTLE WILL START NOW ,SO BE CAREFUL  U PIGS ,ALL REVENGE WILL BE TAKEN  BY OUR ARMY AND WILL FINISH OFF PAKISTAN FROM WORLD  MAP ,ONCE FOR ALL.",NAG
facebook_corpus_msr_443770,"Its his view... and everyone is having right to express it... and yes, i agree...",NAG
facebook_corpus_msr_383482,Pay and park at high street Phoenix mall.. Full loot,NAG
facebook_corpus_msr_333805,"Hindu respect cow mother only?
Cow mother ignore baby & son & daughter & family
Real mother only women respect
Women mother take care about baby & son & daughter & family",NAG
facebook_corpus_msr_434825,"Congratulations to all. Great prizes win for all. Great to all. Great Indians,",NAG
facebook_corpus_msr_440135,PM deserves one more chance...who else can we think of other than him in this present scenario... NOBODY in fact.,NAG
facebook_corpus_msr_490858,"Due to capital gains issues it is apparent that FPIs  would want to invest maximum before this financial year ends.
Even then one 5-10% correction of our markets is a possibility.In anticipation people are keeping some cash.
Is this a right strategy or we should remain fully invested?",NAG
facebook_corpus_msr_331481,"This guy will say, India is important, but Pakistan is more important, because it's Islamic country... 😂",CAG
facebook_corpus_msr_400746,"Aqsa, drop that kashmiri from your name and call yourself Aqsa  Pakistani",NAG
facebook_corpus_msr_467161,sun raha hai na tu... bol raha hun main... 🎼,NAG
facebook_corpus_msr_433427,Having people like you in my life make all the difference...habaybi ento ❤❤,NAG
facebook_corpus_msr_416607,"Your problem can,be solved anytime, anywhere within 24 hours by bharo sidhi pt.jk jyotishi +91-8968848458 sp.in love marriage, sotandur, dusman chutkara, gharkalesh,nokri,videsh yatra,factory, shop, losses,,helth,childless,all kind of problems",NAG
facebook_corpus_msr_407916,"👮 �

  😉

❤  AHAAN NAVEED PATHAAN KE FAN HO PHR TO AP KI POST  ACHI HE HO GIII   😍

 ║🌹║🔰 POWERED BY  ║
  Naveed Pathaan    ║🌹║",NAG
facebook_corpus_msr_466683,Oh now we know this guy can speak when his madam ordered in to speak.,NAG
facebook_corpus_msr_422539,Bharti - now consolidated so is it a good buy,NAG
facebook_corpus_msr_338023,Congress is the best then any others..Jai Indian National Congress,NAG
facebook_corpus_msr_467811,Don't underestimate him...guys he is one of the best econimist we have..,NAG
facebook_corpus_msr_494437,Just of changing name no use of it.....change state in a higher graph......n off course west Bengal.....,NAG
facebook_corpus_msr_405147,Ajmal qasab next PM of India and Hafaiz Saeed next PM of India,NAG
facebook_corpus_msr_433633,Staying on path of fiscal consolidation has got a thumbs up from the market: NK Singh,NAG
facebook_corpus_msr_443518,Any news in Tata Motors as it has recovered smartly from days lows?,NAG
facebook_corpus_msr_331717,I have seen rajamouli and his brahman uncle cleaning toilet... and a dalit is head priest in tirupati...lol mahismati. .. this flim also brahmanwadi agenda...bahubali got poonool..99.99% PRAJA are shudra. ..,NAG
facebook_corpus_msr_402201,It's our mistake...no political stand  on these coward act.... there is anti national political parties......NGO ....Media... who enjoy everything from Indian Land but try to backstab every time...,NAG
facebook_corpus_msr_468731,Hope it was planned well.. still black money in land and gold,OAG
facebook_corpus_msr_473416,I stood in line yesterday. Senior citizen r having separate counters in many banks.,NAG
facebook_corpus_msr_467766,"A person who has compromised  India using His position as  RBI chief, Finance Minister, PM.",NAG
facebook_corpus_msr_330494,Gujarati leaders won't spk as army jawans killed and never single gujarati in army in last 70 years ? Will BJP keaders send his son to join army ?,CAG
facebook_corpus_msr_433465,"If a Medium sized T Shirt fits someone perfectly, should u mindlessly purchase the same size? Os should u try and be rational?",NAG
facebook_corpus_msr_466447,"And who do you think YOU are, to decide, who's an insider and who's an outsider?
The current problem of the mammoth amounts of black money is more because of the enemy INSIDE of India than outside. So it's not that all Indians residing in India are the holy saints.
- demolishing your moronic comment from Dubai.",CAG
facebook_corpus_msr_477608,"Very very good decision. Thanks to our Prime Minister ,Modiji",NAG
facebook_corpus_msr_334823,"Our foreign policy is going very well partcularly with our neighbors
Confronting policy with China and Pakistan won't do any good",NAG
facebook_corpus_msr_400906,"You have to goes for this facts in  U N O in USA and then you can claims for Kashmir.
Understand you that your Pakistan defeated three times by our India and you divided in two parts that you remember in your mind .",NAG
facebook_corpus_msr_466419,"People he is a well known economist who had brought good in early 90s. Please stop following PM blindly, I too support Modi but the issues he is addressing are real.",NAG
facebook_corpus_msr_477499,Opposition party claims these black money surgical strikes were done previously during UPA tenure : Sources Rahul,NAG
facebook_corpus_msr_426143,Try to apply it yourself Renu Popli Malhotra. It is a nice feeling.,NAG
facebook_corpus_msr_330197,It shows Yogi ji how he give values to people money great sir,NAG
facebook_corpus_msr_491260,whn will v see market reacting to Fed and boj,NAG
facebook_corpus_msr_437991,"Demonetization has eased  the process of bottoming out of prices in real estate sector, it acted in favor of the betterment of the sector ,which otherwise would have taken much more time to recover .Nifty realty index has taken support at 165 currently at 180. DLF also has bounced from 110,Godrejprop, HCC,Prestige,Oberoi,Zandu,Anslhsg all doing good.",NAG
facebook_corpus_msr_330199,What an example !  Nation first. Proud of you Yogi ji.,NAG
facebook_corpus_msr_477674,Will the banks be able to manage the flood of people coming to deposit.? ..,NAG
facebook_corpus_msr_328223,India have lost kashmir because of gay gangsters saffron government have managed to feild kashmir... kashmir will be free then India will come hindu nation mark my word,NAG
facebook_corpus_msr_328181,"We are not gonna win a war against these terrorist ..look at the basic safety SOP followed..no helmet, protective gears& only god knows about the fate of bullet proof jackets",NAG
facebook_corpus_msr_330537,Hahahaaha Aur Bhi Khoon Chaye En #Rundians Ka Bht Maza aareha ha Hum Kashmirio Ko hahahaahaa #GayHind,NAG
facebook_corpus_msr_507591,"So, apparently MakeMyTrip.com ""are trying to resolve our matter"", however, the truth is that no one has even contacted us from makemytrip.
They just verbally book tickets with various vendors without any payment and the money to the vendor is actually given 72 hours before the departure.
In our case, due to such bookings visa got rejected.
So, without even paying a single penny to any vendor, they have kept 2,25,000/- of ours faking that money was forfeit by the vendor.
When asked to prove bookings done by them, they failed miserably.
Spread awareness about such frauds being done by makemytrip.
#saveyourvacationsdonttrustmakemytrip",NAG
facebook_corpus_msr_440117,India does need such a PM .. to get all the corrupt in line,NAG
facebook_corpus_msr_467960,Common man are badly effected. It is waste of energy of common man,NAG
facebook_corpus_msr_332396,"Atul O Pathak if you keep that kinda mindset then i suggest you go saudi Arabia or some other place and the mindset you have doesn't intent on protecting girls but its true intention is just oppressing them, if people like you don't evolve then there will be many more nirbhaya doesn't matter what kind off clothes they wear and did you just defend the nirnhaya case rapists by saying the cause was nirbhaya's clothing, seriously shut the hell up and stop proving you stupidity even more",NAG
facebook_corpus_msr_490553,Bhel  officials said they had biggest order book so far..and executions will be good too,NAG
facebook_corpus_msr_477934,We can return the same to banks for 50 days,NAG
facebook_corpus_msr_477202,Out of box thinking is a trade mark of our prime minister Modiji. This step will definitely help our country to control black money and corruption..,NAG
facebook_corpus_msr_488940,"Uzair Khatri  regret? Lol plz, pay your condolences to your dead terrorist brothers :D",NAG
facebook_corpus_msr_334822,"Always looking towards camera ,

Doesn't surprise me a bit coz the Photoshoping is his trademark.",NAG
facebook_corpus_msr_435292,"Buddy we know you will deliver ..keep going , also stop watching cnbc tv 18",NAG
facebook_corpus_msr_337889,"ATTENTION! REALTORS AND BUYERS!
The real estate sector is going to witness a major change from 1st May 2017. The government is going to implement the Real Estate (Regulation & development) Act, RERA. This act will regulate the real estate market of India. To know more about #RERA, visit : www.apnarera.com",NAG
facebook_corpus_msr_332137,"1) How old is our Mother Earth, with Human Life on it?

2) When did people start to use animals as mode of transport?

3) Does the bull carry any weight of cart?

4) How old is Automobile Industry (vehicle engine & fuel)?

5) How much material has been used to manufacture vehicles, so far (for enormous units)?

6) How much fuel (gas & oil) has been extracted from earth and consumed?

7) How much damage did we make to earth by dig, drill and pull, since the commencement of Automobile Industry?

8) How many trees did we cut and areas have been used for roads and infrastructure?

9) What is the level of air pollution and sound pollution in environment by vehicles?

10) How many vehicles being parked for more than 20 hours, per day?

11) How many vehicles are owned just by ego, for competition and comparison?

12) How much unnecessary consumption of fuel, per day?

13) Do you agree that vehicles carry and move the bullockcart, since 200 years (if engine is bull and cart is commuters and goods)?

14) How long can we continue to carry and move the bullockcart on wheels by burning the economy, drilling planet, polluting environment and bearing sky high costs?

15) Why do all vehicles have to start from standstill positions and moved till destinations by using engine and fuel?

16) Do you support an idea of using the massive weight of commuters and goods on wheels as energy generator (instead of spending huge fuel/energy to carry and move the deadweight)?

17) How many bicycles have been produced every year, only for single riders, globally?

18) Do you prefer to have cycles to families and groups together, with increased efficiency and multiplied capacity?

19) While enjoying mobile revolution, why we need to suffer automobile evolution?

20) Are we ready for a change, with drastic reduction in fuel consumption, elimination of unhealthy pollutions, reduction in overall costs and rapid development with welfare projects?

Let's think different and implement change",NAG
facebook_corpus_msr_477640,What about the local business man...can v accept the money from customers,NAG
facebook_corpus_msr_485110,Obviously it is doing great under the leadership of Nara Chandrababu Naidu !!!,NAG
facebook_corpus_msr_416692,Also there was very less expenditure during nov Dec hence low growth as compared to prev year.,NAG
facebook_corpus_msr_377458,मोदी जी अब कितने राज्यों में आप की सरकार चाहिए सभी राज्य में ताप का सरकार चली रहा है तो भी कोई बदलाव नहीं आ रहा है और जवान मरते जा रहे हैं और आप लोग निंदा पर निंदा करते जा रहे हैं अरे जैसे सब के बीवी बच्चे हैं वैसे जवानों के भी बीवी बच्चे मां है वह लोग कैसे रहेंगे जरा सोचिए हर बार आप लोग निंदा करके चुप हो जाते हैं अरिजीत ने यह चोर नेता है अपने भारत में इनको टिकट देने से पहले इनके इनके कोई लड़कियों को आर्मी एयर डिफेंस एरिया में भर्ती कराओ उसके बाद से टिकट दो किसी भी चुनाव के लिए तब यह देश भक्ति कहलाएंगे एसी में बैठकर देशभक्ति बयान जो करते हैं ना ऐसे कोई देशभक्त नहीं होता है जितने नेता हैं सब के लड़के आउट ऑफ कंट्री पढ़ते हैं और गरीब के लड़के आर्मी और डिफेंस एरिया में जाते हैं और भारत में भी ऐसे ही कुछ नियम है नाचने और गाने वालों को भारत रत्न दिया जाता है और जो देश के लिए शहीद होते हैं उन्हें बस कड़ी निंदा करके दफन कर दिया जाता है,NAG
facebook_corpus_msr_490640,"PSU Banks gave a good bounce today, do you see it sustaining considering the distribution happening today during the day?",NAG
facebook_corpus_msr_483950,"If we see aviation sector of India it is growing very fast. Recently data posted by IATA India will be the biggest market of aviation by 2026.
Another fact if we see then aviation companies have started making profits for example recently air India posted profit since a decade. 
Also govt. Is restructuring this sector by putting some some bar and limits which is beneficial for both customer and companies.",NAG
facebook_corpus_msr_337868,waise he should leav party and be great political crics rather then joining any party,NAG
facebook_corpus_msr_470546,"I have 5000 shares of Pnb @75.90 please tell me 
Hold/sell",NAG
facebook_corpus_msr_341816,"💢 Bot User 💢 Xingh Kannu 💢

 ♥PYTHON♥BOT♥TEAM♥

♪----» TAYYAB-XD.TK «----♪

♥♡o. BOT OWNER 💢 TAYYAB KHAN 💢",NAG
