facebook_corpus_msr_468701,Sanah Amir -- y don't u become a prime minister and execute this plan,NAG
facebook_corpus_msr_409453,"TODAY We proudly celebrate 6th SEPT as a DEFEFCE DAY of our COUNRTY.

when in 1965, our Daring Tigers of PAKISTAN ARMY crushed the planned, organized and secret aggression of the INDIAN Army..
it was the War in which Worlds most number Tank
s were Destroyed..
and in Our Cities we have lots of those Indian Tanks, which were Crushed by Our Heroes.....

PAKISTAN ZINDABAD
PAK ARMY ZINDABAD........
http://www.facebook.com/photo.php?fbid=428040763908650&set=o.130917846955806&type=1",NAG
facebook_corpus_msr_429541,Hope to be at the forefront of India's defence programme: AM Naik,NAG
facebook_corpus_msr_468444,Thank you for this ..please make govt sector online and cash less...still govt sector doesnt accepts cards..we cannot make NEFT orRTGS in urgent need as there is waiting time after adding bene,NAG
facebook_corpus_msr_333577,I am from Assam and this type of incident took place during congress rule also...but first time it is reported 😠_and 4 ur kind info...here there is no so called Gau rakshak forces..u can be lynched even for stealing onions..it totally depends upon peoples mood.😕,NAG
facebook_corpus_msr_488301,"Very great, teach new things to school kids for our country development and feature .....",NAG
facebook_corpus_msr_408960,Ha..ha. What a picture to mock Hindu culture!!She is promoting non-Hindu culture and trying to convert the Congress men to Christianity.,NAG
facebook_corpus_msr_451315,Why there is no Rti for Political parties.. Idiot Bhakts,NAG
facebook_corpus_msr_406231,"Thank you Mr president

Geroge Washington was in favour of it",NAG
facebook_corpus_msr_468440,"White transaction to be a new norm, says Arun Jaitley",NAG
facebook_corpus_msr_495173,Is only central government responsible? What about the state government doing since last 5 years? how to get TRP ....start blaming Central government,NAG
facebook_corpus_msr_469699,Don't panic and stay clam and long term will be good for all,NAG
facebook_corpus_msr_415179,"Cnbc really !?!? Covering some random club match and that too in Bangladesh, either you are super obsessed with cricket or you are out of news !",NAG
facebook_corpus_msr_403698,India is in reverse mode .... trying to adopt mythology of ancient Hindus...It was growing well before BJP's reign. Cow worshipping and now it's time to adopt Sati ....😃,NAG
facebook_corpus_msr_466556,You guys making a fun of genius economist!! He is great Economist but not a Great leader !! Lol,NAG
facebook_corpus_msr_502723,THiS will solve the problem of braindrain in our country and help in home made technological boost !,NAG
facebook_corpus_msr_405056,all problems solution your life pt.Vinod Swami ji call&whatsapp no.+91-9928827268 / get your love back / Vashikaran / husband wife Disput / inter cast love marriage / Black Magic / business prombles Husband wife relationship Family problem solution;lover girlfriend Jadu-Tona contact no.+91-9928827268,NAG
facebook_corpus_msr_466480,"Not to forget 1991, when India was on a brink of declaring bankruptcy.
India's foreign exchange reserves were barely a billion dollars and now is ballooned to 145 $ BILLION.",NAG
facebook_corpus_msr_489989,we r holding tv18 netwrok18 since right issue ..any word on tht...when will it reward investors like other midcaps,NAG
facebook_corpus_msr_495154,Where were u 2 years back ...u never reported such villages existed then ..it is huge failure on Congress and State govt...if u actually cared for the people of the village you would have shown ur concern not complain,NAG
facebook_corpus_msr_477712,For forgot students there have to go bank and how time to change money.,NAG
facebook_corpus_msr_335663,Dalit women raped and force to drink human urine by upper caste,NAG
facebook_corpus_msr_467867,Who so ever are questioning his crediancals should first check their crediencials,NAG
facebook_corpus_msr_443559,"Plz share view on astech life??  Bought @675,  today made 52 week high",NAG
facebook_corpus_msr_470373,"Hi Sonia and Anuj, till when can we expect this kind of volatility in the market and from which level can we start investing ?",NAG
facebook_corpus_msr_372561,"Indian Army trying to divert attention from Kashmir unrest... where they stop internet access,social media bane, violation of human rights , killing of innocent Kashmiries on daily basis....thats why every Kashmiri stands against Indian aggression , but remember the struggle of self determination of Kashmirs people will continue until their freedom..",NAG
facebook_corpus_msr_342162,"#ႩաҽՏօʍҽ_ႽႮԹҽɾɮ

ABP News уσυ 
нανє α nicҽ Tuesday
 ____________________ 
 уσυ ɾ cσσℓ  ABP News",NAG
facebook_corpus_msr_456555,Hi sonia LT food or Kohinoor ....and view in rice stocks for long ...china to import from india,NAG
facebook_corpus_msr_468443,if growth rates are hit for short-term why are these people saying that long term goals would be better..what's wrong is wrong..it does not matter who says or who does it..-_-,NAG
facebook_corpus_msr_403799,He is not India's boss. Turkey is not USA or Russia. Only these two countries can pressurize us. Turkey is just a normal country for us,NAG
facebook_corpus_msr_434197,"What abt nbfc cos like l&tf, Bharat financial or dhfl",NAG
facebook_corpus_msr_401153,"STAR AGENCY
      *Admission started *
STUDY MBBS,MS,MD,MDS IN TOP UNIVERSITIES OF  CHINA AND PHILIPPINES  
*CHINA 
-zhengzhou medical university 
-Guangxi medical university 
-Capital medical university 
-Ningxia medical university 
*Philippines -PERPETUAL university 
-LYCEUM university 
-DAVAD medical university 
*FOR more detail contact whatsapp :  +8615909602428,
Email :-Staragency9186@yahoo.com",NAG
facebook_corpus_msr_355752,"Arvindji please stay away from this person ""kumar biswas"" because he is trying to spoil the party under the influence of bjp. He has alwsys praised shri narender Modi and he cannot be the part of aap. In the last election he contested from amethi as he could help the bjp candidate to win. He tried to damage the vote bank of congress and succeded. He is with the aap just to damage it with his dirty skill.",NAG
facebook_corpus_msr_473109,What if I need same inr in any other country.??,NAG
facebook_corpus_msr_428125,"Great to see you sir for the talking about development of jharkhand 
Jai jharkhand 
Jai hind",NAG
facebook_corpus_msr_377586,"thanx pak army 

loads of love and prayers from Kashmir

indian deserves wrost then this

hope Pakistan will never forget the indian brutalities which we Kashmiries are facing from last 70 years
Pakistan zindabad
Kashmir paindabad",NAG
facebook_corpus_msr_506300,Modi ko kosne wale Nitish- Laloo combine now following Gujrat model.Ha.. Ha..ha,NAG
facebook_corpus_msr_377485,"Pakistani army ki taraf se Indian army ki do shaheedo ki vitambana.. 
Modiji : hum iski kadi ninda karte hai.. 
Rajnath singh : hum ninda karte hai..  
Are ninda karte karte jawano / shaheedo ke naam par kaafi Chanda ekattha kiya aapne. 
Ab kuch action dikhao ya phir satta chod do..",NAG
facebook_corpus_msr_342163,"💢 Bot User 💢 Xingh Kannu 💢

 ♥PYTHON♥BOT♥TEAM♥

♪----» TAYYAB-XD.TK «----♪

♥♡o. BOT OWNER 💢 TAYYAB KHAN 💢",NAG
facebook_corpus_msr_489881,8700 put premiums eaten up by 75% in 2 hours.. Why is that so?,NAG
facebook_corpus_msr_507439,Hy i'm Florida follow me if you want to good friendship with me.i'm making new friends.....,NAG
facebook_corpus_msr_328229,"Why India Should #ScrapIndusWatersTreaty
Indus Water Treaty Is Illegal
The case of the 1960 Indus waters treaty, it has been signed by then Prime Minister Jawaharlal Nehru and “nowhere it is declared that the said agreement/treaty has been signed in the name of the President of India”, 
“According to the ministry of external affairs documents, nowhere disclosed agreement has been signed by the Jawaharlal Nehru for the President of India...,” 

“According to the impugned agreement 80% water goes to Pakistan which is a serious injury to the fundamental right of the citizens of India coupled with further financial and natural injuries to national interest.”

If We Indians Keep Quit Today Our Future Generations Will Blame Us And Never Going To Forgive Us

India Need Be Like China Fast And Furious And Must Have Ability To Say On Face.
China Claim South China Sea 
China Made And Develop 7 Artificial Man Made Islands On The South China Sea So Quickly 
Then Why Can't India Stop Water From Our Own States And Union Territories Of India
We Need To Build More Dam On Indus River And Must Have Iccha-Shakti To Say Only One Sentence To World Bank F*ck Off 
India Is Scraping Indus Waters Treaty

If China Can Do For Their Mother Land 
Then Why Not India (If India Cannot Do)
Then Their Is Some Serious Problem In Our Indian Government System With Our Political Partys And Also With Our Useless Politician.
Who Just Know To Bark But Cannot Take Action.

http://siteresources.worldbank.org/INTSOUTHASIA/Resources/223497-1105737253588/IndusWatersTreaty1960.pdf",NAG
facebook_corpus_msr_325512,Pak army rape modi daughter and go back. Now modi looking 4 real father of his grandchild,NAG
facebook_corpus_msr_414006,"Gifting to the legal heir or to the concerned person in blood relation is not illegal, diversion of funds from company to personal use is illegal though",NAG
facebook_corpus_msr_471905,This is the time to stand united. Not for complaining.,NAG
facebook_corpus_msr_470517,Hi anuj and Sonia pls share ur view on AVIATION SECTOR.,NAG
facebook_corpus_msr_466674,Dear Manmohan ji ... you are a economist ... you know this better than modi ji ... the taken step are appropriate for black money surgical strike ... please support the same by heart not by party mind ..,NAG
facebook_corpus_msr_470716,When you became older and your son PM think even if you take a chance to walk bank for Money exchange.. hope you understand and even if she is not a mother of PM we will respect and give a way directly to the counter by respecting the age....,NAG
facebook_corpus_msr_334593,Good.    Why they run to pak they have enough customers in India how much money they want.   Sm,NAG
facebook_corpus_msr_481823,"Trump as Hillary made Investigation on Modi, the coordination like Obama may loose and we know he has women phobia through his body language at many events.. So Trump would be better.  Anyhow both are worst as Trump is pro corporate and Hillary is corrupt..",NAG
facebook_corpus_msr_330538,"एक फोन मे आपकी life change कर दुंगा((your problm solved in.3 days))
+91-9815215009 ONE CALL ONLY CHANGE YOUR LIFE BY ASTROLOGER((MY WHTSS APP NO.+919815215009))your ex lover back your life by astro,husband wife physical problm solution,All problm solution by astrologer +91-9815215009",NAG
facebook_corpus_msr_331713,Jus to degrade the reputation of a person nd the hit he gave .... i think u cant digest it so makong all possible ways to degrade hmm,NAG
facebook_corpus_msr_495179,How can central government say it's the work of state government what is Mr.Yadav doing Ohh laying eggs:-),NAG
facebook_corpus_msr_457205,Or why lenovo only focusing on mobiles why not in gaming...on my opinion lenovo should establish gaming stores in every developed cities,NAG
facebook_corpus_msr_467734,kitna jhootha hai aggarwal. usa is not having 11% inflation.  infact fed is trying thier best to create a 2% inflation so that they can raise the rate. but they are not able to do that.,NAG
facebook_corpus_msr_477792,Ppl i am sure there is some strategy in pulling the money from the banks in other countries as well. But for now this is a brave move by India 🇮🇳it would trouble the common man for couple of days but on the long run this is going to make all of us happy and India will not be called developing country anymore.... 🙏🏻🙏🏻🙏🏻,NAG
facebook_corpus_msr_468764,It has to be done like the way it was done...you can not prepare and give lead time...,NAG
facebook_corpus_msr_405904,Where is money goes not jawans get nor kissan poor people not get food all goes to pockets,NAG
facebook_corpus_msr_333755,cow smuggling and thefts r common in assam as they were smuggledinto Bangladesh from there having very high price,NAG
facebook_corpus_msr_331536,"Omer Beigh you mean to say ,then they can talk about kashmir but we can not talk about Kurds.
You know , that's why we doubt patriotism of Muslims like you , who enjoys being an Indian thrashed by Turkey PM.
These Turkish",OAG
facebook_corpus_msr_490792,Wt do u say abt l & t where it go,NAG
facebook_corpus_msr_335850,And Our beloved PM Says Talaq Talaq Talaq to Dalits,NAG
facebook_corpus_msr_438591,This wil b good in education .wil give  clearer vision of math n physics fundamentals esp trignometry,NAG
facebook_corpus_msr_436975,Bloody news channel check what is happening in Tamil nadu,OAG
facebook_corpus_msr_490633,Whats on L&T mind? Two similar ipos in three months...,NAG
facebook_corpus_msr_466467,Dude even now the problem of atm is existing and long queues in bank. If such an initiative is to be taken then atleast the ground level work should have been strong. The reason behind telling is the govt banks are least cooperative even in this situation . An action should be taken against such employees. The idea of demonetisation would have been successful if all the bank employees support this moment and help the ppl rather than doing the opposite of what has been told. Timinaksh Sharma,NAG
facebook_corpus_msr_495003,Annual income not more than 6 lakhs . And no home in the name of their and their family .,NAG
facebook_corpus_msr_478194,and what about the money which is already in swiss bank?,NAG
facebook_corpus_msr_473016,"how will a local kirana store except that card in a rural area, there lies the real problem",NAG
facebook_corpus_msr_473124,"NRI, living far from Indian bank, 18000 Rupees, not visiting india before. 30th Dec. What should I do?",NAG
facebook_corpus_msr_467876,Dont show your stupidity by disrespecting such a  honourable person,NAG
facebook_corpus_msr_418199,'811' is a digital account opening experience that can be done anytime: Uday Kotak,NAG
facebook_corpus_msr_468670,And so that everyone should have gotto know that simething fishi is to happen..!! Is that what you mean..?? 😂,NAG
facebook_corpus_msr_477689,The move that very much needed form a long time. This is good governance indeed.,NAG
facebook_corpus_msr_469855,He says Modi did this on wrong season for farmers..  Then what time he should have done?  Every month has something....,NAG
facebook_corpus_msr_440982,Hats off to Modi's leadership. We Indians couldn't get a better,NAG
facebook_corpus_msr_405361,Tum to o bhi nahi karskte karke dikhanaa thumare g main dum Hain toh tum to Sirf bakte ho Kuch karke dikawo Teri MC BC,OAG
facebook_corpus_msr_477951,Just go and deposit in the bank.. and file ur ITR,NAG
facebook_corpus_msr_428135,"Success means dhoni  ,the success of investor meet is because of dhoni",NAG
facebook_corpus_msr_471866,Good decision however pls make sure that ATM are having sufficient money especially 100 notes,NAG
facebook_corpus_msr_332151,What is this! Some kind of New thuglaq dystopian dream,NAG
facebook_corpus_msr_477780,Proude of our india whay becouse black money whell be raten,NAG
facebook_corpus_msr_472063,Take appointment from bank..  Why people want exchange of money...  Very simple so that the money cant be detected else the best way is to deposit money..  But in the name of exchange same person is visiting different banks which increases the number of queue...  Check all the ids taken by different banks....,NAG
facebook_corpus_msr_418861,tv18 network 18 ...plz show some good profits and real results ....if u guys show complicated results wat to expect from others ? ur number one ..common,NAG
facebook_corpus_msr_325498,"Pak soldiers are not human why you
do not blame these demonsPak paid
media stop such",NAG
facebook_corpus_msr_406190,Did he do something new!?!? You have the same rights you had since the amendment was written. Give thanks only when due. Thank him for being so shady. Now that he's put effort in.,NAG
facebook_corpus_msr_331686,Liberals and secular can't digest success of BB2 as there is no insult of Hinduism.,NAG
facebook_corpus_msr_466589,Hats of Modiji you made even deaf spoke. What an initiative.,NAG
facebook_corpus_msr_497231,what is the max altitude ? .....are he selling the adventure or creating brand enfield here ..hidden agenda behind the ride,NAG
facebook_corpus_msr_441761,Huge huge buying seen in delta or sks???confirms double bottom ???????????,NAG
facebook_corpus_msr_404744,Because Pakistan is a dystopian military dictatorship and a state-sponsor of global Islamic terrorism...,NAG
facebook_corpus_msr_442126,"For short term which sectors to look upon ?
May be for 1-2 month",NAG
facebook_corpus_msr_470723,Obviously dude..today also i was in d queue fr 5 hrs,NAG
facebook_corpus_msr_398064,"All india Muslim 
With INDIAN AARMY
Jai hind
Non stop firing on paak border.",NAG
facebook_corpus_msr_408295,Always begging :D  Instead of PCB they should rename it to PBB (Pakistan Beggar Board),NAG
facebook_corpus_msr_466591,See the level of affect ...maun mohan has started speaking,CAG
facebook_corpus_msr_406195,"Claire Bowen Delaughder, why are you people so easily scared. Just come up with stuff to scare yourself, and believe it. You don't see the trend or tactics shall I say. It's a republican memo. Just like Bush he comes into office trying scare you. A potus is supposed to do opposite. And you fall for it again. You wasn't this scared last year. Nobody disputes protecting yourself and your home. The issue is all the senseless murder. Either you support senseless murder or you don't. Cut the crap and let's focus and WORK on sensible plan.",NAG
facebook_corpus_msr_466445,1000 of people died in freedom war in 1857 to 1947.... what did  Indian government do for them that time... Plz tell,NAG
facebook_corpus_msr_466465,The idea of demonetisation was good bt it could have been implemented in a better manner. Dr Manmohan Singh is an expert in this field so don't condemn him.,NAG
facebook_corpus_msr_372888,Honey Singh   I love my bat force 🇵🇰😘.,NAG
facebook_corpus_msr_467613,"Totally agree with Manmohan Singh, He never said in his speech that the move was wrong. He told that the implementation was flawed. CNBC-TV18 #DeMonetisation",NAG
facebook_corpus_msr_442310,"Vguard view or Chemical space like bodal, thirumalai, sudharshan view ?",NAG
facebook_corpus_msr_331486,"Intolerance on Kashmir by few gober brain Indians can't sustain Kashmir .grow up its packing from Kashmir 
I don't hate india and Indians .most of ppl are lovable but they don't in social media",NAG
facebook_corpus_msr_341618,"Gandhi Killer Ram (Nathu) Temple in India......

Big Shame 4 India........",OAG
facebook_corpus_msr_496127,"Is Govt. 'silently with baby stepping' working on highly centralised "" G to G, G to B, B to G, B to B & finally G to C eliminating B to C in longrun "" economic model??✔ Signs are here. What will happened  if  Delivery on Demand replaces retail section ??",NAG
facebook_corpus_msr_464795,"Do you guys calculated loss due to  cascading effects ,if yes then make research more widespread",NAG
facebook_corpus_msr_443733,This is one of best investor camp among all.... well organized information by all experts.....,NAG
facebook_corpus_msr_466002,Honorable prime minister will not sit he will leave no stone unturned to remove a major portion of corruption in the country . Just wait n watch,NAG
facebook_corpus_msr_335730,Ndtv people are like bugs..what ever good thinng are happening in country ...but they show only these news....,NAG
facebook_corpus_msr_490477,Impact of fed rate hike and rbi rate cut...in indian market?,NAG
facebook_corpus_msr_406943,"If days before Vinod Khanna looked so normal, then how come he got dehydrated so quickly that even ended his life! Surprising !",NAG
facebook_corpus_msr_414818,Hahaha that's true should have heart in business n yes it's true mostly men die heart attack 👻,NAG
facebook_corpus_msr_503595,"U r wrong check the history records 
She was Harita Kaur Deol",NAG
facebook_corpus_msr_504804,Superb as Narendra Modi has evolved his English Raghuram has evolved his Hindi,NAG
facebook_corpus_msr_506715,"Worst F.M ever.what about 5  lakhs tax limit? ,said during election.",NAG
facebook_corpus_msr_457204,if lenovo still making such type of cool device and their customers hapyy in future then next year they will be in the #1 position in india,NAG
facebook_corpus_msr_481481,"Nifty below 8550 , indicates a down move maybe coming",NAG
facebook_corpus_msr_398047,Proceed the case with terrorists act ! He must have connections with ISI,NAG
facebook_corpus_msr_495338,"But Sir, this GDP growth will make rich more richer and others job less. 
In last decade the GDP growth hardly replicated in job growth.",NAG
facebook_corpus_msr_440981,"Why was UPI not promoted earlier, why Paytm was promoted instead of UPI?",NAG
facebook_corpus_msr_402368,"This step taken by the Respected CM is praiseworthy. Such step should also be taken by our respected CM, Nitish kumar in Bihar",NAG
facebook_corpus_msr_471859,But people who dnt pay tax ... deal in black money .. it's a surgical strike for them,NAG
facebook_corpus_msr_404733,"Cow in Hinduism:

Eating Beef (Cow Mata) allowed in Hinduism.
Rigveda (10/85/13) declares, “On the occasion of a girl’s marriage oxen and cows are slaughtered.” 
Rigveda (6/17/1) states that “Indra used to eat the meat of cow, calf, horse and buffalo.” 
Manusmriti (Chapter 5 / Verse 30) says, “It is not sinful to eat meat of eatable animals, for Brahma has created both the eaters and the eatables.”
Maharishi Yagyavalkya says in Shatpath Brahmin (3/1/2/21) that, “I eat beef because it is very soft and delicious.”
Apastamb Grihsutram (1/3/10) says, “The cow should be slaughtered on the arrival of a guest, on the occasion of ‘Shraddha’ of ancestors and on the occasion of a marriage.”
Vashistha Dharmasutra (11/34) writes, “If a Brahmin refuses to eat the meat offered to him on the occasion of ‘Shraddha’ or worship, he goes to hell.”",NAG
facebook_corpus_msr_492712,have your  pen got ink filled ..please check ethan ...we are selling ink bottle here,NAG
facebook_corpus_msr_333739,Even 2 month old baby girl is not safe in India...yet cow is safe...,NAG
facebook_corpus_msr_419652,In our times he is the original thinker. It goes to his credit that those who criticised his ideas in past decade have adopted the verysame ideas successfully to improve governance now.,NAG
facebook_corpus_msr_489405,Every Indian is proud of what army did last night #beunited,NAG
facebook_corpus_msr_477529,I think there should be some option and clarity on it which we will have to wait and watch. If I get any legitimate info on the same will post for the benefit of all.,NAG
facebook_corpus_msr_335703,Oh!!Such a mean degrading inhumane people. Would like to kill them. Nature's bounty is for all. Nobody can deny the right,NAG
facebook_corpus_msr_490643,Lata and shareen Bhan Sonia Shenoy best group of ladies in cnbc tc 18,NAG
facebook_corpus_msr_467685,Can our Ex PM give solution rather just   Speaking against how this has been implemented,NAG
facebook_corpus_msr_477643,What will people abroad do with the indian currency where can they exchange the money,NAG
facebook_corpus_msr_353342,"We want peace 
BUT NOT AT THIS PRICE NEVER
So whenever they do shits like this we must answer the in the most appropriate way
WE need not be inhumane
BUT DESTROY EVERY BASE OF THEM INVOLVE  IN THE heinous crime and more than that",NAG
facebook_corpus_msr_393747,India must attack continuously. One single attack on porkistan will not do any damage to them neither will lower their morale.,NAG
facebook_corpus_msr_487682,sky is the limit ..mind is the elevators ...make sure you have the power to raise to the heights ...for honda gen set advt,NAG
facebook_corpus_msr_406206,"Sharon Rowley, trump did NOTHING to allow me be licensed, carry or own a gun! Come to the 21st century girl! And you can have him! Bahahahahahaha! #waitingforimpeachment",NAG
facebook_corpus_msr_331535,Dude india have not such diplomatic courage to talk about matter of Turkey .You will thrash,OAG
facebook_corpus_msr_466520,Looks like he was programmed yday to speak this way by Sonia 😜,CAG
facebook_corpus_msr_482887,Cyrus is virus he trying ambanification of tata group of company ethic and people come first for tata group than profit,OAG
facebook_corpus_msr_441346,"Domestically and internationally, the Modi government is stumbling from one blunder to another",OAG
facebook_corpus_msr_331495,Turkey is supporting those isis thugs and now they dare lecture us on kashmir issue...their bad times are about to start i guess...😂😂😂😂,OAG
facebook_corpus_msr_468445,all transactions will be online...wow ..so if you want to buy a small pack of maggi noodles or want to buy a kilo of grocery ..you will use online transactions..??Has old age crippled their nervous system..:/ ??,CAG
facebook_corpus_msr_466435,One minute silence for all those entering insulting comments on MMS. If this man didn't open up economy in 1990s you all will be living in f#*&ing socialist country.,CAG
facebook_corpus_msr_402026,Twinkle Khanna has no business to critise Sr.journlist .  She knows only acting in flop movies.,OAG
facebook_corpus_msr_440976,"Corporate people are happy. Common people are in the midst of insecurity
and patthetic situation .",CAG
